{"$schema":"https://json-schema.org/draft/2020-12/schema","$id":"https://wiki-spike.local/schemas/second-brain/decision-record-v1.schema.json","title":"Second Brain Decision Record V1","type":"object","additionalProperties":false,"required":["decision_version","decision_id","outcome","scope_kind","scope_name","record_revision","decided_at","supersedes","post_interview_reconciliation","reason","evidence_refs","evidence_digest","expires_at","signatures"],"$defs":{"signature":{"type":"object","additionalProperties":false,"required":["signature_version","role","key_id","public_key_b64","signature_b64"],"properties":{"signature_version":{"const":"second-brain-decision-signature-v1"},"role":{"enum":["owner","approver"]},"key_id":{"type":"string","minLength":1},"public_key_b64":{"type":"string","minLength":1},"signature_b64":{"type":"string","minLength":1}}}},"properties":{"decision_version":{"const":"second-brain-decision-record-v1"},"decision_id":{"enum":["DB-01","DB-02","DB-03","DB-04","DB-05","DB-06","DB-07","DB-08"]},"outcome":{"enum":["GO","NO_GO"]},"scope_kind":{"enum":["global","source_profile","migration_source","external_model_route","export_destination"]},"scope_name":{"type":["string","null"]},"reason":{"type":"string","minLength":1},"evidence_refs":{"type":"array","minItems":1,"uniqueItems":true,"items":{"type":"string","minLength":1}},"evidence_digest":{"type":"string","pattern":"^[0-9a-f]{64}$"},"expires_at":{"type":"string","format":"date-time"},"signatures":{"type":"array","minItems":2,"maxItems":2,"prefixItems":[{"allOf":[{"$ref":"#/$defs/signature"},{"properties":{"role":{"const":"approver"}}}]},{"allOf":[{"$ref":"#/$defs/signature"},{"properties":{"role":{"const":"owner"}}}]}],"items":false},"record_revision":{"type":"string","pattern":"^[1-9][0-9]*$"},"decided_at":{"type":"string","format":"date-time"},"supersedes":{"type":["object","null"],"additionalProperties":false,"required":["decision_id","scope_kind","scope_name","record_revision","decision_digest"],"properties":{"decision_id":{"enum":["DB-01","DB-02","DB-03","DB-04","DB-05","DB-06","DB-07","DB-08"]},"scope_kind":{"enum":["global","source_profile","migration_source","external_model_route","export_destination"]},"scope_name":{"type":["string","null"]},"record_revision":{"type":"string","pattern":"^[1-9][0-9]*$"},"decision_digest":{"type":"string","pattern":"^[0-9a-f]{64}$"}}},"post_interview_reconciliation":{"type":"object","additionalProperties":false,"required":["original_question","reconciliation"],"properties":{"original_question":{"type":"string","minLength":1},"reconciliation":{"type":"string","minLength":1}}}},"allOf":[{"if":{"properties":{"decision_id":{"enum":["DB-01","DB-04","DB-05","DB-07"]}}},"then":{"properties":{"scope_kind":{"const":"global"},"scope_name":{"const":null}}}},{"if":{"properties":{"decision_id":{"const":"DB-02"}}},"then":{"properties":{"scope_kind":{"const":"source_profile"},"scope_name":{"type":"string","minLength":1}}}},{"if":{"properties":{"decision_id":{"const":"DB-03"}}},"then":{"properties":{"scope_kind":{"const":"migration_source"},"scope_name":{"type":"string","minLength":1}}}},{"if":{"properties":{"decision_id":{"const":"DB-06"}}},"then":{"properties":{"scope_kind":{"const":"external_model_route"},"scope_name":{"type":"string","minLength":1}}}},{"if":{"properties":{"decision_id":{"const":"DB-08"}}},"then":{"properties":{"scope_kind":{"const":"export_destination"},"scope_name":{"type":"string","minLength":1}}}},{"if":{"properties":{"record_revision":{"const":"1"}}},"then":{"properties":{"supersedes":{"const":null}}},"else":{"properties":{"supersedes":{"type":"object"}}}}]}
