{"decided_at":"2026-08-18T15:38:52Z","decision_id":"DB-02","decision_version":"second-brain-decision-record-v1","evidence_digest":"212681cefcc07725f71b784ec1ab3af95fde5e1f6062247201d2d688226fbcaf","evidence_refs":["artifacts/product-release/second-brain-v1/evidence/db-02-capture-disabled-evidence-v1.json"],"expires_at":"2027-08-18T15:38:52Z","outcome":"NO_GO","post_interview_reconciliation":{"original_question":"Codex, Claude/Memory Bank, Git, and Markdown are all intended first-release sources, but each remains disabled until its source-specific consent, retention, deletion, capability, and fixture evidence resolves GO.","reconciliation":"Claude/Memory Bank remains synthetic-only and is excluded from enabled capture sources, capabilities, and cohorts. No configuration, adapter, retry, provider substitution, or fallback may re-enable it. This scoped NO_GO does not disable approved read-only migration sources or authenticated manual product operations. A future GO requires a signed superseding record with source-specific consent, retention, deletion, capability, and fixture evidence."},"reason":"NO_GO: no approved live Claude/Memory Bank account scope, consent fixture, retention/deletion proof, capability fixture, or immutable source evidence exists for the Mac-first private release. Fail closed rather than enable an unresolved live capture boundary.","record_revision":"1","scope_kind":"source_profile","scope_name":"Claude/Memory Bank","signatures":[{"key_id":"wiki-spike-local-approver-2026","public_key_b64":"qqjshbOlaEeE5umj4jBVJPYqOqFypULm4nX9FSxIMNQ=","role":"approver","signature_b64":"Iag1hadz/GPbURBc1HoNRxVpNbkbjHTflVRJl5glJWbxCGVNo5VkGaxlvBTk1IC97fBcb564eYNu1I4YVtfODQ==","signature_version":"second-brain-decision-signature-v1"},{"key_id":"wiki-spike-local-owner-2026","public_key_b64":"AqkUcin7vP0DSKNKq77+AoG4dLivjs7gBQC+I2U0znQ=","role":"owner","signature_b64":"kb3Tvra5tJBkao6LUVwlK7tMqt+OE3MrgKOiodS3W23RtrZJkMQ8S1IxMadUdOvS/qX5w5bUpRJj3d0mk6DhBg==","signature_version":"second-brain-decision-signature-v1"}],"supersedes":null}