{"decided_at":"2026-08-21T22:18:10Z","decision_id":"DB-01","decision_version":"second-brain-decision-record-v1","evidence_digest":"e356b47cbea3d97b3ec88676f7f40b2a9a5f5c5366f9b0fca50153eab8b81638","evidence_refs":["artifacts/product-release/second-brain-v1/evidence/db-01-identity-auth-evidence-bundle-v1.json"],"expires_at":"2027-08-21T22:18:10Z","outcome":"GO","post_interview_reconciliation":{"original_question":"Single user with multiple trusted devices; explicit delegated reviewers are permitted. Delegation is action-scoped, revocable, auditable, and never grants ownership transfer.","reconciliation":"The owner approved the reconciled single-owner, trusted-device, action-scoped delegation contract. This GO binds the existing DB-01 threat, conformance, and authorization UX fixture bundle and remains subject to its expiry and revocation rules."},"reason":"Owner approval received for the evidence-bound identity and authorization contract. GO authorizes only the exact single-owner, trusted-device, scoped-delegation behavior covered by the referenced bundle.","record_revision":"1","scope_kind":"global","scope_name":null,"signatures":[{"key_id":"wiki-spike-local-approver-2026","public_key_b64":"qqjshbOlaEeE5umj4jBVJPYqOqFypULm4nX9FSxIMNQ=","role":"approver","signature_b64":"hUH2G7cnkLxK7GfONC1yxsnALbHjd9/G0MIs5O0k968Y1s7atRpggzXunq4nqfxKSfKwlnywDQe19QUVot+tBw==","signature_version":"second-brain-decision-signature-v1"},{"key_id":"wiki-spike-local-owner-2026","public_key_b64":"AqkUcin7vP0DSKNKq77+AoG4dLivjs7gBQC+I2U0znQ=","role":"owner","signature_b64":"VwqNpO5ajIrvEtcALe88cAOXGoYBi0x9RkXAnF2sKuu632HWGZOVG6qA9DVkAkZnOx6aNTNbjQuoHufebQr8BA==","signature_version":"second-brain-decision-signature-v1"}],"supersedes":null}