{"decided_at":"2030-01-01T00:00:00Z","decision_id":"DB-03","decision_version":"second-brain-decision-record-v1","evidence_digest":"9e7d68ae8df714da7464b908872580ca2f83bd62fd7041bd7bd04239ff122aeb","evidence_refs":["artifacts/product-release/second-brain-v1/unified-db-inventory-v1.json"],"expires_at":"2030-01-01T00:00:00Z","outcome":"NO_GO","post_interview_reconciliation":{"original_question":"unified-db, legacy Mem0/RAG, and me-wiki are all intended read-only migration sources. Each must independently satisfy export, identity, revision, watermark, deletion-history, and fixture requirements; no runtime fallback is allowed.","reconciliation":"This unsigned body binds unified-db-inventory-v1.json by digest. Inventory defaultDecision remains STOP_PENDING_IMMUTABLE_SNAPSHOT_AND_DIFF, so outcome is NO_GO. It does not authorize live capture, DSN read, SQL, mapper registration, or import."},"reason":"unified-db inventory defaultDecision is STOP_PENDING_IMMUTABLE_SNAPSHOT_AND_DIFF. No immutable snapshot or diff exists, so this identity is NO_GO. This unsigned body does not authorize live capture, DSN read, SQL, mapper registration, or import.","record_revision":"1","scope_kind":"migration_source","scope_name":"unified-db","signatures":[{"key_id":"wiki-spike-local-approver-2026","public_key_b64":"qqjshbOlaEeE5umj4jBVJPYqOqFypULm4nX9FSxIMNQ=","role":"approver","signature_b64":"7ipU1v1MGMDcgzQSy4c3HxwFFOfia/UoACgqi5HZOitb5UZWpGkXVDDn/l4YlUErJeb7SjhNhaOisMKxab8TDw==","signature_version":"second-brain-decision-signature-v1"},{"key_id":"wiki-spike-local-owner-2026","public_key_b64":"AqkUcin7vP0DSKNKq77+AoG4dLivjs7gBQC+I2U0znQ=","role":"owner","signature_b64":"fq/qyS/k9qlAUrZLXlicet7DPbObQ/aouJmxtQwSA3ZjQA5REobVdGk8l6NalY1MxexHHKUq0PV7y2qe8cSCBg==","signature_version":"second-brain-decision-signature-v1"}],"supersedes":null}