{
  "decided_at": "2026-07-30T15:09:47Z",
  "decision_id": "DB-02",
  "decision_version": "second-brain-decision-record-v1",
  "evidence_digest": "41f31f8e53d793c59e8f3c96a6b67e06c13567108f09bd229833b571d4bc955f",
  "evidence_refs": [
    "artifacts/product-release/second-brain-v1/local-boot/evidence/packs/DB-02__Codex.json"
  ],
  "expires_at": "2030-12-31T00:00:00Z",
  "outcome": "GO",
  "post_interview_reconciliation": {
    "original_question": "May Codex be an enabled first-release live capture source?",
    "reconciliation": "Codex is GO as source_profile; live capture still requires capability/consent at runtime."
  },
  "reason": "Enable Codex as intended live source profile after consent/capability gates.",
  "record_revision": "1",
  "scope_kind": "source_profile",
  "scope_name": "Codex",
  "signatures": [
    {
      "key_id": "approver",
      "public_key_b64": "qqjshbOlaEeE5umj4jBVJPYqOqFypULm4nX9FSxIMNQ=",
      "role": "approver",
      "signature_b64": "NZoPKXG8wyLUCSsOzx/Tmgy31teLNXmnzcQReLq/Fs35sZ/CL8CWG293aVQTCJLipUr9NQVLs0+X4TQUeL02Aw==",
      "signature_version": "second-brain-decision-signature-v1"
    },
    {
      "key_id": "owner",
      "public_key_b64": "AqkUcin7vP0DSKNKq77+AoG4dLivjs7gBQC+I2U0znQ=",
      "role": "owner",
      "signature_b64": "bWiRQmdg+IKPzB0/SLAkCv0SfDRsXzle4wa6hri1ws2b2BMUYN27peIXcgfYrOsB9iQ3Kn/7/HqopWdSNKh0CQ==",
      "signature_version": "second-brain-decision-signature-v1"
    }
  ],
  "supersedes": null
}
