{
  "decided_at": "2026-07-30T15:09:47Z",
  "decision_id": "DB-07",
  "decision_version": "second-brain-decision-record-v1",
  "evidence_digest": "81edc2a16176d191c1896480c850dbaed93f12592e369aaf274e7b42bc162709",
  "evidence_refs": [
    "artifacts/product-release/second-brain-v1/local-boot/evidence/packs/DB-07.json"
  ],
  "expires_at": "2030-12-31T00:00:00Z",
  "outcome": "GO",
  "post_interview_reconciliation": {
    "original_question": "Under what conditions may sources cut over?",
    "reconciliation": "3-day shadow, four-role signed cutover, mutation closes rollback; no automatic cutover in local boot."
  },
  "reason": "Authorize source-by-source cohort cutover controls without auto cutover.",
  "record_revision": "1",
  "scope_kind": "global",
  "scope_name": null,
  "signatures": [
    {
      "key_id": "approver",
      "public_key_b64": "qqjshbOlaEeE5umj4jBVJPYqOqFypULm4nX9FSxIMNQ=",
      "role": "approver",
      "signature_b64": "hk4rFepkNfB622lRVxogwfBM8cfwQpoEXmItooETmkniDYHB+3nFND4PxCRPe8rKr/PQPDB2nLDaLIhEODlfBw==",
      "signature_version": "second-brain-decision-signature-v1"
    },
    {
      "key_id": "owner",
      "public_key_b64": "AqkUcin7vP0DSKNKq77+AoG4dLivjs7gBQC+I2U0znQ=",
      "role": "owner",
      "signature_b64": "/OAucH7zl9FtZrgXcQEJrzNlmDNVNtgJsINpntB501fOBL5QVfx/3fPoQZZ2JJcHBZ7jPuzsuvoKN3IknILhDA==",
      "signature_version": "second-brain-decision-signature-v1"
    }
  ],
  "supersedes": null
}
