{
  "decided_at": "2026-07-30T15:09:47Z",
  "decision_id": "DB-03",
  "decision_version": "second-brain-decision-record-v1",
  "evidence_digest": "1ef1ab3f1e54258d94246972f470da17042a8fa0e4fe1becf940076fd320aba5",
  "evidence_refs": [
    "artifacts/product-release/second-brain-v1/local-boot/evidence/packs/DB-03__me-wiki.json"
  ],
  "expires_at": "2030-12-31T00:00:00Z",
  "outcome": "GO",
  "post_interview_reconciliation": {
    "original_question": "May me-wiki be imported as a read-only migration source?",
    "reconciliation": "me-wiki is GO for read-only migration registration only; no serving fallback."
  },
  "reason": "Register me-wiki as read-only migration source only.",
  "record_revision": "1",
  "scope_kind": "migration_source",
  "scope_name": "me-wiki",
  "signatures": [
    {
      "key_id": "approver",
      "public_key_b64": "qqjshbOlaEeE5umj4jBVJPYqOqFypULm4nX9FSxIMNQ=",
      "role": "approver",
      "signature_b64": "nrPggoBa1hWyq0QnUvUgB0hrIOKe2auqzj986UGmRO9E0c234kEWlo7mvQ5SNJOIySQZlhW2riPLIPBRnuV6Aw==",
      "signature_version": "second-brain-decision-signature-v1"
    },
    {
      "key_id": "owner",
      "public_key_b64": "AqkUcin7vP0DSKNKq77+AoG4dLivjs7gBQC+I2U0znQ=",
      "role": "owner",
      "signature_b64": "1lirFopa2V31oe7I4R8EDXM9CtppdfiNhKEMvQSCKyAWP6hXcItLFglH7jGXBd+69iEMtcd/JoLc7/nR0bfcCQ==",
      "signature_version": "second-brain-decision-signature-v1"
    }
  ],
  "supersedes": null
}
