{
  "decided_at": "2026-08-18T15:38:52Z",
  "decision_id": "DB-07",
  "decision_version": "second-brain-decision-record-v1",
  "evidence_digest": "9fc1124073e56fd0b5745d2212a924dda6b4d4d7f2ff5c5474e4aa924835328f",
  "evidence_refs": [
    "artifacts/product-release/second-brain-v1/evidence/db-07-policy-authorization-evidence-v1.json"
  ],
  "expires_at": "2027-08-18T15:38:52Z",
  "outcome": "GO",
  "post_interview_reconciliation": {
    "original_question": "Under what conditions may sources move to wiki-spike, and what happens to the prior systems?",
    "reconciliation": "Authorize the Mac-first private cutover and retention policy only. Migrate exactly one enabled source at a time into a non-serving final-workspace cohort. A cohort may be considered for activation only after at least one full signed observation day, 200 parity cases per source, 500 cohort E2E queries, one-sided 95% Wilson lower bounds meeting the frozen DB-05 floors, zero safety violations, an unchanged holdout, and separate migration, quality, security, and product approvals. Before the first canonical mutation, emergency rollback is allowed only from ROUTE_SWITCHED_NO_MUTATION to the exact read-only pre-cutover surface with banner and write freeze. The first canonical mutation permanently closes legacy rollback; subsequent failure must disable or abstain. Prior GO source systems remain read-only until trusted activation time plus exactly 90 times 24 hours. This record supplies policy authorization only and supplies no shadow, cutover, activation, retention-completion, decommission, deletion, or revocation evidence."
  },
  "reason": "GO for the global Mac-first cutover and retention policy. The one-day quantitative floor is reconciled by issue #79 and commit 84ea5298cc6cf29db236c3054a867ced1c107e1b. This policy remains inert until the complete DB/GOV resolution and a future evidence-backed, independently approved cohort CutoverDecision are accepted. Missing operational evidence fails closed.",
  "record_revision": "1",
  "scope_kind": "global",
  "scope_name": null,
  "signatures": [
    {
      "key_id": "wiki-spike-local-approver-2026",
      "public_key_b64": "qqjshbOlaEeE5umj4jBVJPYqOqFypULm4nX9FSxIMNQ=",
      "role": "approver",
      "signature_b64": "I9zbW7j2VmkYMRza65G3C5qLMD8OEkC0WtZlpKtwAgq1sL1QCjy3sRj474GWc1XgaXjv+ieG6d/W/BzY1gUzAw==",
      "signature_version": "second-brain-decision-signature-v1"
    },
    {
      "key_id": "wiki-spike-local-owner-2026",
      "public_key_b64": "AqkUcin7vP0DSKNKq77+AoG4dLivjs7gBQC+I2U0znQ=",
      "role": "owner",
      "signature_b64": "gVcFulDeKyTu/4wxiyYL9o6520bIWh9jU2jouCAxvq3NFbb9fAMqioW8X7U/r8+bAp4Zwpc4ktXOQ+HYHiDjBQ==",
      "signature_version": "second-brain-decision-signature-v1"
    }
  ],
  "supersedes": null
}
