{"decided_at":"2026-08-21T22:18:10Z","decision_id":"DB-03","decision_version":"second-brain-decision-record-v1","evidence_digest":"de4786a6203657504bec7767269be298c016128c3832deb28fda0fd55d8c9852","evidence_refs":["artifacts/product-release/second-brain-v1/evidence/me-wiki-source-evidence-v1.json"],"expires_at":"2027-08-21T22:18:10Z","outcome":"GO","post_interview_reconciliation":{"original_question":"unified-db, legacy Mem0/RAG, and me-wiki are all intended read-only migration sources. Each must independently satisfy export, identity, revision, watermark, deletion-history, and fixture requirements; no runtime fallback is allowed.","reconciliation":"The owner approved me-wiki as a read-only migration source under the body-free profile and synthetic mapping fixture bound by this record. This GO authorizes contract-compliant import only; it does not authorize serving promotion, fallback, or source mutation."},"reason":"Owner approval received for the evidence-bound me-wiki migration contract. GO is limited to the exact read-only, body-free, no-fallback behavior in the referenced source evidence.","record_revision":"1","scope_kind":"migration_source","scope_name":"me-wiki","signatures":[{"key_id":"wiki-spike-local-approver-2026","public_key_b64":"qqjshbOlaEeE5umj4jBVJPYqOqFypULm4nX9FSxIMNQ=","role":"approver","signature_b64":"S8SXS8nmQHbunegWw4clxthbB7fkvLdMAb8EBfzGk5zHmzMq/9ZVZCf3GwTKgvZNrAJc2+CbM3kJDCmB7doQBw==","signature_version":"second-brain-decision-signature-v1"},{"key_id":"wiki-spike-local-owner-2026","public_key_b64":"AqkUcin7vP0DSKNKq77+AoG4dLivjs7gBQC+I2U0znQ=","role":"owner","signature_b64":"RYdhX0+Ax8yWwrCHBrUjnvsrPJGl07VQwJyX3wb2fNmsEnrcVffZdaACrwko2Gx5IVJbiHRZDPshq05uVqtdCQ==","signature_version":"second-brain-decision-signature-v1"}],"supersedes":null}