{"decided_at":"2026-08-18T15:38:52Z","decision_id":"DB-03","decision_version":"second-brain-decision-record-v1","evidence_digest":"9e7d68ae8df714da7464b908872580ca2f83bd62fd7041bd7bd04239ff122aeb","evidence_refs":["artifacts/product-release/second-brain-v1/unified-db-inventory-v1.json"],"expires_at":"2027-08-18T15:38:52Z","outcome":"NO_GO","post_interview_reconciliation":{"original_question":"unified-db, legacy Mem0/RAG, and me-wiki are all intended read-only migration sources. Each must independently satisfy export, identity, revision, watermark, deletion-history, and fixture requirements; no runtime fallback is allowed.","reconciliation":"legacy Mem0/RAG is excluded from every independent migration cohort. Legacy-origin rows represented inside unified-db remain eligible only through a later evidence-complete unified-db GO cohort. No direct legacy import, retry, substitution, serving authority, or runtime fallback is allowed. If zero-residual coverage later finds authorized legacy-only data, stop and require a superseding decision."},"reason":"NO_GO: the current inventory contains legacy-mem0 and legacy-rag material inside unified-db while uniqueness remains unresolved, an active run was observed, explicit tombstones are absent, and deletion history is incomplete. An independent legacy cohort would create overlapping authority and duplicate risk.","record_revision":"1","scope_kind":"migration_source","scope_name":"legacy Mem0/RAG","signatures":[{"key_id":"wiki-spike-local-approver-2026","public_key_b64":"qqjshbOlaEeE5umj4jBVJPYqOqFypULm4nX9FSxIMNQ=","role":"approver","signature_b64":"nwvhleQ6X6VfD1Sw8bMQa0SocUzAEGrK8KS0D19MyvF8txfSYt2RfX0uZz1UiRj400MF24cq/LUglcGoaWPbAQ==","signature_version":"second-brain-decision-signature-v1"},{"key_id":"wiki-spike-local-owner-2026","public_key_b64":"AqkUcin7vP0DSKNKq77+AoG4dLivjs7gBQC+I2U0znQ=","role":"owner","signature_b64":"6WIs/z69kvq8Xn64NpVF+NvN1T6dkqdv8ST0trVyztvko8dAi3YvLUBbB3MeSiifo6hR3v+g0gZKW8YzXuyQAA==","signature_version":"second-brain-decision-signature-v1"}],"supersedes":null}